"NOMBRE","ACTIVIDAD","DIRECCION","X","X.1","origin","DIRECCION.CLEAN","regexp","calle","numero"
"CASA DEL HISTORIADOR - ARCHIVO HISTORICO DE LA CIUDAD DE BUENOS AIRES","ARCHIVO","BOLIVAR 466",NA,NA,"D2","bolivar 466","^([a-z ]*)([0-9]+)","bolivar","466"
"ESPACIO VIRREY LINIERS","ARCHIVO","VENEZUELA 469",NA,NA,"D2","venezuela 469","^([a-z ]*)([0-9]+)","venezuela","469"
"BIBLIOTECA  CANONIGO LUIS JOSE DE CHORROARIN","BIBLIOTECA","SOLDADO DE LA FRONTERA AV. 5059",NA,NA,"D2","soldado de la frontera av 5059","^([a-z ]*)([0-9]+)","soldado de la frontera av","5059"
"BIBLIOTECA ALFONSINA STORNI","BIBLIOTECA","VENEZUELA 1538",NA,NA,"D2","venezuela 1538","^([a-z ]*)([0-9]+)","venezuela","1538"
"BIBLIOTECA ALVARO YUNQUE","BIBLIOTECA","SOLDADO DE LA FRONTERA AV. 5210",NA,NA,"D2","soldado de la frontera av 5210","^([a-z ]*)([0-9]+)","soldado de la frontera av","5210"
"BIBLIOTECA ANTONIO DEVOTO (CON ANEXO INFANTIL)","BIBLIOTECA","BAHIA BLANCA 4025",NA,NA,"D2","bahia blanca 4025","^([a-z ]*)([0-9]+)","bahia blanca","4025"
"BIBLIOTECA BALDOMERO FERNANDEZ MORENO","BIBLIOTECA","ARENAL, CONCEPCION 4206",NA,NA,"D2","arenal concepcion 4206","^([a-z ]*)([0-9]+)","arenal concepcion","4206"
"BIBLIOTECA BENITO LYNCH (CON ANEXO INFANTIL)","BIBLIOTECA","YRUPE 6714",NA,NA,"D2","yrupe 6714","^([a-z ]*)([0-9]+)","yrupe","6714"
"BIBLIOTECA BRIGADIER GENERAL CORNELIO SAAVEDRA","BIBLIOTECA","LARRALDE, CRISOLOGO AV. 6293",NA,NA,"D2","larralde crisologo av 6293","^([a-z ]*)([0-9]+)","larralde crisologo av","6293"
"BIBLIOTECA CARLOS GUIDO Y SPANO","BIBLIOTECA","GUEMES 4601",NA,NA,"D2","guemes 4601","^([a-z ]*)([0-9]+)","guemes","4601"
"BIBLIOTECA CIRCE - BIBLIOTECA TESORO","BIBLIOTECA","CORDOBA AV. 1558",NA,NA,"D2","cordoba av 1558","^([a-z ]*)([0-9]+)","cordoba av","1558"
"BIBLIOTECA ENRIQUE BANCHS (INFANTO JUVENIL)","BIBLIOTECA","CASEROS AV. 3100",NA,NA,"D2","caseros av 3100","^([a-z ]*)([0-9]+)","caseros av","3100"
"BIBLIOTECA ESTANISLAO DEL CAMPO","BIBLIOTECA","DE LAS ARTES 1210",NA,NA,"D2","de las artes 1210","^([a-z ]*)([0-9]+)","de las artes","1210"
"BIBLIOTECA EVARISTO CARRIEGO","BIBLIOTECA","HONDURAS 3784",NA,NA,"D2","honduras 3784","^([a-z ]*)([0-9]+)","honduras","3784"
"BIBLIOTECA HILARIO ASCASUBI","BIBLIOTECA","DIAZ, CESAR, GRAL. 4219",NA,NA,"D2","diaz cesar gral 4219","^([a-z ]*)([0-9]+)","diaz cesar gral","4219"
"BIBLIOTECA JAVIER VILLAFAÑE (CON ANEXO INFANTIL)","BIBLIOTECA","JANER, ANA MARIA Y TORRES Y TENORIO, PRES.",NA,NA,"D2","janer ana maria y torres y tenorio pres","","janer ana maria y torres y tenorio pres","janer ana maria y torres y tenorio pres"
"BIBLIOTECA JOAQUIN V. GONZALEZ (CON ANEXO INFANTIL)","BIBLIOTECA","SUAREZ 408",NA,NA,"D2","suarez 408","^([a-z ]*)([0-9]+)","suarez","408"
"BIBLIOTECA JOSE HERNANDEZ","BIBLIOTECA","BOQUERON 6753",NA,NA,"D2","boqueron 6753","^([a-z ]*)([0-9]+)","boqueron","6753"
"BIBLIOTECA JOSE MARMOL","BIBLIOTECA","JURAMENTO 2937",NA,NA,"D2","juramento 2937","^([a-z ]*)([0-9]+)","juramento","2937"
"BIBLIOTECA JULIO CESAR SAGUIER (CON ANEXO INFANTIL)","BIBLIOTECA","DELLEPIANE, LUIS, TTE. GRAL. 4801",NA,NA,"D2","dellepiane luis tte gral 4801","^([a-z ]*)([0-9]+)","dellepiane luis tte gral","4801"
"BIBLIOTECA JULIO CORTAZAR / CASA DE LA LECTURA","BIBLIOTECA","LAVALLEJA 924",NA,NA,"D2","lavalleja 924","^([a-z ]*)([0-9]+)","lavalleja","924"
"BIBLIOTECA LA PRENSA","BIBLIOTECA","PAZ, JOSE C. 3300",NA,NA,"D2","paz jose c 3300","^([a-z ]*)([0-9]+)","paz jose c","3300"
"BIBLIOTECA REINA BATATA (INFANTO JUVENIL)","BIBLIOTECA","11 DE SEPTIEMBRE DE 1888 Y LA PAMPA",NA,NA,"D2","11 de septiembre de 1888 y la pampa","^([a-z ]*)([0-9]+)","de septiembre de 1888 y la pampa","11 de septiembre de 1888 y la pampa"
"BIBLIOTECA LEOPOLDO LUGONES","BIBLIOTECA","LA PAMPA 2215",NA,NA,"D2","la pampa 2215","^([a-z ]*)([0-9]+)","la pampa","2215"
"BIBLIOTECA MANUEL GALVEZ","BIBLIOTECA","CORDOBA AV. 1558",NA,NA,"D2","cordoba av 1558","^([a-z ]*)([0-9]+)","cordoba av","1558"
"BIBLIOTECA MARIANO PELLIZA","BIBLIOTECA","CRANWELL 819",NA,NA,"D2","cranwell 819","^([a-z ]*)([0-9]+)","cranwell","819"
"BIBLIOTECA MARTIN DEL BARCO CENTENERA (CON ANEXO DE GENERO)","BIBLIOTECA","VENEZUELA 1538",NA,NA,"D2","venezuela 1538","^([a-z ]*)([0-9]+)","venezuela","1538"
"BIBLIOTECA MIGUEL CANE (CON ANEXO INFANTIL)","BIBLIOTECA","CALVO, CARLOS AV. 4319",NA,NA,"D2","calvo carlos av 4319","^([a-z ]*)([0-9]+)","calvo carlos av","4319"
"BIBLIOTECA NORAH LANGE","BIBLIOTECA","FERNANDEZ DE LA CRUZ, F., GRAL. AV. Y ESCALADA AV.",NA,NA,"D2","fernandez de la cruz f gral av y escalada av","","fernandez de la cruz f gral av y escalada av","fernandez de la cruz f gral av y escalada av"
"BIBLIOTECA RAFAEL OBLIGADO","BIBLIOTECA","CRAINQUEVILLE 2233",NA,NA,"D2","crainqueville 2233","^([a-z ]*)([0-9]+)","crainqueville","2233"
"BIBLIOTECA RICARDO GUIRALDES","BIBLIOTECA","TALCAHUANO 1261",NA,NA,"D2","talcahuano 1261","^([a-z ]*)([0-9]+)","talcahuano","1261"
"CASA DE LA LECTURA - ESPACIO CULTURAL","BIBLIOTECA","LAVALLEJA 924",NA,NA,"D2","lavalleja 924","^([a-z ]*)([0-9]+)","lavalleja","924"
"CASA DE LA CULTURA","CENTRO CULTURAL","DE MAYO AV. 575",NA,NA,"D2","de mayo av 575","^([a-z ]*)([0-9]+)","de mayo av","575"
"CENTRO CULTURAL ALBERTO OLMEDO","CENTRO CULTURAL","VIALE, LUIS 1052",NA,NA,"D2","viale luis 1052","^([a-z ]*)([0-9]+)","viale luis","1052"
"CENTRO CULTURAL ALFONSINA STORNI","CENTRO CULTURAL","TUCUMAN 3233",NA,NA,"D2","tucuman 3233","^([a-z ]*)([0-9]+)","tucuman","3233"
"CENTRO CULTURAL BALDOMERO FERNANDEZ MORENO","CENTRO CULTURAL","MERCEDES 1405",NA,NA,"D2","mercedes 1405","^([a-z ]*)([0-9]+)","mercedes","1405"
"CENTRO CULTURAL GENERAL SAN MARTIN","CENTRO CULTURAL","SARMIENTO 1551",NA,NA,"D2","sarmiento 1551","^([a-z ]*)([0-9]+)","sarmiento","1551"
"CENTRO CULTURAL NUESTRA TIERRA","CENTRO CULTURAL","IRIARTE, GRAL. AV. Y MONTESQUIEU",NA,NA,"D2","iriarte gral av y montesquieu","","iriarte gral av y montesquieu","iriarte gral av y montesquieu"
"CENTRO CULTURAL RECOLETA","CENTRO CULTURAL","JUNIN 1930",NA,NA,"D2","junin 1930","^([a-z ]*)([0-9]+)","junin","1930"
"CENTRO CULTURAL TATO BORES","CENTRO CULTURAL","SOLER 3929",NA,NA,"D2","soler 3929","^([a-z ]*)([0-9]+)","soler","3929"
"COMPLEJO CULTURAL CHACRA DE LOS REMEDIOS","CENTRO CULTURAL","DIRECTORIO AV. Y LACARRA",NA,NA,"D2","directorio av y lacarra","","directorio av y lacarra","directorio av y lacarra"
"LA VIDRIERA DE LA DGEART","CENTRO CULTURAL","PERU 374",NA,NA,"D2","peru 374","^([a-z ]*)([0-9]+)","peru","374"
"USINA DEL ARTE","CENTRO CULTURAL","DON PEDRO DE MENDOZA AV. Y CAFFARENA, AGUSTIN R.",NA,NA,"D2","don pedro de mendoza av y caffarena agustin r","","don pedro de mendoza av y caffarena agustin r","don pedro de mendoza av y caffarena agustin r"
"CENTRO CULTURAL ADAN BUENOS AYRES","CENTRO CULTURAL","ASAMBLEA AV. 1200",NA,NA,"D2","asamblea av 1200","^([a-z ]*)([0-9]+)","asamblea av","1200"
"CENTRO CULTURAL ANIBAL TROILO","CENTRO CULTURAL","GORRITI 5740",NA,NA,"D2","gorriti 5740","^([a-z ]*)([0-9]+)","gorriti","5740"
"CENTRO CULTURAL ARTES DE PARQUE CHACABUCO","CENTRO CULTURAL","CACHIMAYO 1657",NA,NA,"D2","cachimayo 1657","^([a-z ]*)([0-9]+)","cachimayo","1657"
"CENTRO CULTURAL BARRIO COPELLO","CENTRO CULTURAL","DELLEPIANE, LUIS, TTE. GRAL. 4900",NA,NA,"D2","dellepiane luis tte gral 4900","^([a-z ]*)([0-9]+)","dellepiane luis tte gral","4900"
"CENTRO CULTURAL BARRIO RIVADAVIA","CENTRO CULTURAL","COBO AV. Y CURAPALIGUE",NA,NA,"D2","cobo av y curapaligue","","cobo av y curapaligue","cobo av y curapaligue"
"CENTRO CULTURAL BELGRANO R.","CENTRO CULTURAL","LA PAMPA 3855",NA,NA,"D2","la pampa 3855","^([a-z ]*)([0-9]+)","la pampa","3855"
"CENTRO CULTURAL BOEDO","CENTRO CULTURAL","CASTRO 954",NA,NA,"D2","castro 954","^([a-z ]*)([0-9]+)","castro","954"
"CENTRO CULTURAL CEPNA (CENTRO DE ESTUDIOS Y PROYECTOS NUEVA ARGENTINA)","CENTRO CULTURAL","MURGUIONDO 4361",NA,NA,"D2","murguiondo 4361","^([a-z ]*)([0-9]+)","murguiondo","4361"
"CENTRO CULTURAL COLEGIALES","CENTRO CULTURAL","CONDE 943",NA,NA,"D2","conde 943","^([a-z ]*)([0-9]+)","conde","943"
"CENTRO CULTURAL DEL BAJO FLORES","CENTRO CULTURAL","RIESTRA AV. 1650",NA,NA,"D2","riestra av 1650","^([a-z ]*)([0-9]+)","riestra av","1650"
"CENTRO CULTURAL DEL SUR","CENTRO CULTURAL","CASEROS AV. 1750",NA,NA,"D2","caseros av 1750","^([a-z ]*)([0-9]+)","caseros av","1750"
"CENTRO CULTURAL DEVOTO","CENTRO CULTURAL","NUEVA YORK 4169",NA,NA,"D2","nueva york 4169","^([a-z ]*)([0-9]+)","nueva york","4169"
"CENTRO CULTURAL DISCEPOLIN","CENTRO CULTURAL","TRONADOR 4134",NA,NA,"D2","tronador 4134","^([a-z ]*)([0-9]+)","tronador","4134"
"CENTRO CULTURAL EL ETERNAUTA","CENTRO CULTURAL","LOBOS, ELEODORO, DR. 437",NA,NA,"D2","lobos eleodoro dr 437","^([a-z ]*)([0-9]+)","lobos eleodoro dr","437"
"CENTRO CULTURAL EL TALLER","CENTRO CULTURAL","GONZALEZ, ELPIDIO 4967",NA,NA,"D2","gonzalez elpidio 4967","^([a-z ]*)([0-9]+)","gonzalez elpidio","4967"
"CENTRO CULTURAL ELADIA BLAZQUEZ","CENTRO CULTURAL","RABANAL, FRANCISCO, INTENDENTE AV. 2275",NA,NA,"D2","rabanal francisco intendente av 2275","^([a-z ]*)([0-9]+)","rabanal francisco intendente av","2275"
"CENTRO CULTURAL ELIAS CASTELNUOVO","CENTRO CULTURAL","MONTIEL 1041",NA,NA,"D2","montiel 1041","^([a-z ]*)([0-9]+)","montiel","1041"
"CENTRO CULTURAL FORTUNATO LACAMERA","CENTRO CULTURAL","SAN JUAN AV. 353",NA,NA,"D2","san juan av 353","^([a-z ]*)([0-9]+)","san juan av","353"
"CENTRO CULTURAL HOMERO MANZI","CENTRO CULTURAL","TILCARA 3365",NA,NA,"D2","tilcara 3365","^([a-z ]*)([0-9]+)","tilcara","3365"
"CENTRO CULTURAL JUAN CARLOS CASTAGNINO","CENTRO CULTURAL","PAZ, GRAL. AV. Y 2 DE ABRIL DE 1982",NA,NA,"D2","paz gral av y 2 de abril de 1982","^([a-z ]*)([0-9]+)","paz gral av y  de abril de 1982","2 de abril de 1982"
"CENTRO CULTURAL JULIO CORTAZAR","CENTRO CULTURAL","O'HIGGINS 3050",NA,NA,"D2","ohiggins 3050","^([a-z ]*)([0-9]+)","ohiggins","3050"
"CENTRO CULTURAL LA CASITA DE LA SELVA","CENTRO CULTURAL","LA SELVA 4022",NA,NA,"D2","la selva 4022","^([a-z ]*)([0-9]+)","la selva","4022"
"CENTRO CULTURAL LA PATERNAL - VILLA MITRE","CENTRO CULTURAL","CARACAS 1249",NA,NA,"D2","caracas 1249","^([a-z ]*)([0-9]+)","caracas","1249"
"CENTRO CULTURAL LA USINA","CENTRO CULTURAL","SANTO DOMINGO 2752",NA,NA,"D2","santo domingo 2752","^([a-z ]*)([0-9]+)","santo domingo","2752"
"CENTRO CULTURAL LINO E. SPILIMBERGO","CENTRO CULTURAL","PEREZ, ROQUE 3545",NA,NA,"D2","perez roque 3545","^([a-z ]*)([0-9]+)","perez roque","3545"
"CENTRO CULTURAL LOLA MORA","CENTRO CULTURAL","RIO DE JANEIRO 946",NA,NA,"D2","rio de janeiro 946","^([a-z ]*)([0-9]+)","rio de janeiro","946"
"CENTRO CULTURAL MACEDONIO FERNANDEZ","CENTRO CULTURAL","LEGUIZAMON, MARTINIANO 1470",NA,NA,"D2","leguizamon martiniano 1470","^([a-z ]*)([0-9]+)","leguizamon martiniano","1470"
"CENTRO CULTURAL MARCO DEL PONT","CENTRO CULTURAL","ARTIGAS, JOSE GERVASIO, GRAL. 202",NA,NA,"D2","artigas jose gervasio gral 202","^([a-z ]*)([0-9]+)","artigas jose gervasio gral","202"
"CENTRO CULTURAL OSVALDO PUGLIESE","CENTRO CULTURAL","ARAOZ 234",NA,NA,"D2","araoz 234","^([a-z ]*)([0-9]+)","araoz","234"
"CENTRO CULTURAL PLAZA DEFENSA","CENTRO CULTURAL","DEFENSA 535",NA,NA,"D2","defensa 535","^([a-z ]*)([0-9]+)","defensa","535"
"CENTRO CULTURAL RESURGIMIENTO","CENTRO CULTURAL","ARTIGAS, JOSE GERVASIO, GRAL. 2262",NA,NA,"D2","artigas jose gervasio gral 2262","^([a-z ]*)([0-9]+)","artigas jose gervasio gral","2262"
"CENTRO CULTURAL ROBERTO ARLT","CENTRO CULTURAL","AVELLANEDA AV. 2547",NA,NA,"D2","avellaneda av 2547","^([a-z ]*)([0-9]+)","avellaneda av","2547"
"CENTRO CULTURAL ROBERTO SANTORO","CENTRO CULTURAL","GIRIBONE 1961",NA,NA,"D2","giribone 1961","^([a-z ]*)([0-9]+)","giribone","1961"
"CENTRO CULTURAL SALADIYO","CENTRO CULTURAL","BERON DE ASTRADA 5920",NA,NA,"D2","beron de astrada 5920","^([a-z ]*)([0-9]+)","beron de astrada","5920"
"CENTRO CULTURAL SEBASTIAN PIANA","CENTRO CULTURAL","PUAN 360",NA,NA,"D2","puan 360","^([a-z ]*)([0-9]+)","puan","360"
"CENTRO CULTURAL VERSALLES","CENTRO CULTURAL","BRUSELAS 785",NA,NA,"D2","bruselas 785","^([a-z ]*)([0-9]+)","bruselas","785"
"ESPACIO CULTURAL CARLOS GARDEL","CENTRO CULTURAL","OLLEROS 3640",NA,NA,"D2","olleros 3640","^([a-z ]*)([0-9]+)","olleros","3640"
"ESPACIO CULTURAL JULIAN CENTEYA","CENTRO CULTURAL","SAN JUAN AV. 3255",NA,NA,"D2","san juan av 3255","^([a-z ]*)([0-9]+)","san juan av","3255"
"CINE EL PLATA","CINE","ALBERDI, JUAN BAUTISTA AV. 5751",NA,NA,"D2","alberdi juan bautista av 5751","^([a-z ]*)([0-9]+)","alberdi juan bautista av","5751"
"POLO CIRCO","CIRCO","COMBATE DE LOS POZOS Y GARAY, JUAN DE AV.",NA,NA,"D2","combate de los pozos y garay juan de av","","combate de los pozos y garay juan de av","combate de los pozos y garay juan de av"
"CONSERVATORIO SUPERIOR DE MUSICA DE LA CIUDAD DE BS. AS. ASTOR PIAZZOLLA","ESPACIO DE FORMACION (CARRERAS, SEMINARIOS Y TALLERES)","SARMIENTO 3401",NA,NA,"D2","sarmiento 3401","^([a-z ]*)([0-9]+)","sarmiento","3401"
"CONSERVATORIO SUPERIOR DE MUSICA MANUEL DE FALLA - ANEXO 1","ESPACIO DE FORMACION (CARRERAS, SEMINARIOS Y TALLERES)","BARCO CENTENERA DEL 741",NA,NA,"D2","barco centenera del 741","^([a-z ]*)([0-9]+)","barco centenera del","741"
"CONSERVATORIO SUPERIOR DE MUSICA MANUEL DE FALLA - ANEXO 2","ESPACIO DE FORMACION (CARRERAS, SEMINARIOS Y TALLERES)","SALGUERO, JERONIMO 2445",NA,NA,"D2","salguero jeronimo 2445","^([a-z ]*)([0-9]+)","salguero jeronimo","2445"
"CONSERVATORIO SUPERIOR DE MUSICA MANUEL DE FALLA - ANEXO 3","ESPACIO DE FORMACION (CARRERAS, SEMINARIOS Y TALLERES)","HUMBERTO 1 3171",NA,NA,"D2","humberto 1 3171","^([a-z ]*)([0-9]+)","humberto  3171","1 3171"
"CONSERVATORIO SUPERIOR DE MUSICA MANUEL DE FALLA - ANEXO 4","ESPACIO DE FORMACION (CARRERAS, SEMINARIOS Y TALLERES)","CAMARGO 725",NA,NA,"D2","camargo 725","^([a-z ]*)([0-9]+)","camargo","725"
"CONSERVATORIO SUPERIOR DE MUSICA MANUEL DE FALLA - SEDE CENTRAL","ESPACIO DE FORMACION (CARRERAS, SEMINARIOS Y TALLERES)","GALLO 238",NA,NA,"D2","gallo 238","^([a-z ]*)([0-9]+)","gallo","238"
"ESCUELA METROPOLITANA DE ARTE DRAMATICA - ANEXO 1","ESPACIO DE FORMACION (CARRERAS, SEMINARIOS Y TALLERES)","JUFRE 141",NA,NA,"D2","jufre 141","^([a-z ]*)([0-9]+)","jufre","141"
"ESCUELA METROPOLITANA DE ARTE DRAMATICO","ESPACIO DE FORMACION (CARRERAS, SEMINARIOS Y TALLERES)","SARMIENTO 2573",NA,NA,"D2","sarmiento 2573","^([a-z ]*)([0-9]+)","sarmiento","2573"
"ESPACIO TEATRAL LOS ANDES","ESPACIO DE FORMACION (CARRERAS, SEMINARIOS Y TALLERES)","LEIVA 4249",NA,NA,"D2","leiva 4249","^([a-z ]*)([0-9]+)","leiva","4249"
"ESTUDIO URBANO","ESPACIO DE FORMACION (CARRERAS, SEMINARIOS Y TALLERES)","CURAPALIGUE 585",NA,NA,"D2","curapaligue 585","^([a-z ]*)([0-9]+)","curapaligue","585"
"INSTITUTO DE INVESTIGACION EN ETNOMUSICOLOGIA","ESPACIO DE FORMACION (CARRERAS, SEMINARIOS Y TALLERES)","BOLIVAR 191",NA,NA,"D2","bolivar 191","^([a-z ]*)([0-9]+)","bolivar","191"
"INSTITUTO VOCACIONAL DE ARTE MANUEL JOSE DE LABARDEN - ANEXO 1","ESPACIO DE FORMACION (CARRERAS, SEMINARIOS Y TALLERES)","CURAPALIGUE AV. 1026",NA,NA,"D2","curapaligue av 1026","^([a-z ]*)([0-9]+)","curapaligue av","1026"
"INSTITUTO VOCACIONAL DE ARTE MANUEL JOSE DE LABARDEN - ANEXO 2","ESPACIO DE FORMACION (CARRERAS, SEMINARIOS Y TALLERES)","COLLIVADINO, PIO 470",NA,NA,"D2","collivadino pio 470","^([a-z ]*)([0-9]+)","collivadino pio","470"
"INSTITUTO VOCACIONAL DE ARTE MANUEL JOSE DE LABARDEN - SEDE CENTRAL","ESPACIO DE FORMACION (CARRERAS, SEMINARIOS Y TALLERES)","GARAY, JUAN DE AV. 1684",NA,NA,"D2","garay juan de av 1684","^([a-z ]*)([0-9]+)","garay juan de av","1684"
"RECREO DE LAS ARTES - SEDE CONSTITUCION","ESPACIO DE FORMACION (CARRERAS, SEMINARIOS Y TALLERES)","SOLIS 1815",NA,NA,"D2","solis 1815","^([a-z ]*)([0-9]+)","solis","1815"
"RECREO DE LAS ARTES - SEDE LA BOCA","ESPACIO DE FORMACION (CARRERAS, SEMINARIOS Y TALLERES)","ROCHA 1226",NA,NA,"D2","rocha 1226","^([a-z ]*)([0-9]+)","rocha","1226"
"AUDITORIO EVA PERON - PARQUE CENTENARIO","ESPACIO ESCENICO (TEATRO, MUSICA Y DANZA)","PATRICIAS ARGENTINAS AV. Y LILLO AV.",NA,NA,"D2","patricias argentinas av y lillo av","","patricias argentinas av y lillo av","patricias argentinas av y lillo av"
"TEATRO 25 DE MAYO","ESPACIO ESCENICO (TEATRO, MUSICA Y DANZA)","TRIUNVIRATO AV. 4444",NA,NA,"D2","triunvirato av 4444","^([a-z ]*)([0-9]+)","triunvirato av","4444"
"TEATRO COLON","ESPACIO ESCENICO (TEATRO, MUSICA Y DANZA)","CERRITO 618",NA,NA,"D2","cerrito 618","^([a-z ]*)([0-9]+)","cerrito","618"
"TEATRO DE LA RIBERA","ESPACIO ESCENICO (TEATRO, MUSICA Y DANZA)","DON PEDRO DE MENDOZA AV. 1821",NA,NA,"D2","don pedro de mendoza av 1821","^([a-z ]*)([0-9]+)","don pedro de mendoza av","1821"
"TEATRO GENERAL SAN MARTIN","ESPACIO ESCENICO (TEATRO, MUSICA Y DANZA)","CORRIENTES AV. 1530",NA,NA,"D2","corrientes av 1530","^([a-z ]*)([0-9]+)","corrientes av","1530"
"TEATRO PRESIDENTE ALVEAR","ESPACIO ESCENICO (TEATRO, MUSICA Y DANZA)","CORRIENTES AV. 1659",NA,NA,"D2","corrientes av 1659","^([a-z ]*)([0-9]+)","corrientes av","1659"
"TEATRO REGIO","ESPACIO ESCENICO (TEATRO, MUSICA Y DANZA)","CORDOBA AV. 6065",NA,NA,"D2","cordoba av 6065","^([a-z ]*)([0-9]+)","cordoba av","6065"
"TEATRO SARMIENTO","ESPACIO ESCENICO (TEATRO, MUSICA Y DANZA)","SARMIENTO AV. 2715",NA,NA,"D2","sarmiento av 2715","^([a-z ]*)([0-9]+)","sarmiento av","2715"
"CASA HISTORICA ISAAC FERNANDEZ BLANCO","MUSEO","YRIGOYEN, HIPOLITO 1420",NA,NA,"D2","yrigoyen hipolito 1420","^([a-z ]*)([0-9]+)","yrigoyen hipolito","1420"
"CENTRO DE MUSEOS DE BUENOS AIRES (DIRECCION GENERAL DE MUSEOS)","MUSEO","DE LOS ITALIANOS AV. Y VILLAFLOR, AZUCENA",NA,NA,"D2","de los italianos av y villaflor azucena","","de los italianos av y villaflor azucena","de los italianos av y villaflor azucena"
"MUSEO CASA CARLOS GARDEL","MUSEO","JAURES, JEAN 735",NA,NA,"D2","jaures jean 735","^([a-z ]*)([0-9]+)","jaures jean","735"
"MUSEO DE ARTE ESPAÑOL ENRIQUE LARRETA","MUSEO","JURAMENTO AV. 2291",NA,NA,"D2","juramento av 2291","^([a-z ]*)([0-9]+)","juramento av","2291"
"MUSEO DE ARTE HISPANOAMERICANO ISAAC FERNANDEZ BLANCO","MUSEO","SUIPACHA 1422",NA,NA,"D2","suipacha 1422","^([a-z ]*)([0-9]+)","suipacha","1422"
"MUSEO DE ARTE MODERNO DE BUENOS AIRES","MUSEO","SAN JUAN AV. 350",NA,NA,"D2","san juan av 350","^([a-z ]*)([0-9]+)","san juan av","350"
"MUSEO DE ARTE POPULAR JOSE HERNANDEZ","MUSEO","DEL LIBERTADOR AV. 2373",NA,NA,"D2","del libertador av 2373","^([a-z ]*)([0-9]+)","del libertador av","2373"
"MUSEO DE ARTES PLASTICAS EDUARDO SIVORI","MUSEO","ISABEL, INFANTA AV. 555",NA,NA,"D2","isabel infanta av 555","^([a-z ]*)([0-9]+)","isabel infanta av","555"
"MUSEO DE ESCULTURAS LUIS PERLOTTI","MUSEO","PUJOL 642",NA,NA,"D2","pujol 642","^([a-z ]*)([0-9]+)","pujol","642"
"MUSEO DE LA CIUDAD","MUSEO","DEFENSA 219",NA,NA,"D2","defensa 219","^([a-z ]*)([0-9]+)","defensa","219"
"MUSEO DEL CINE PABLO DUCROS HICKEN (SEDE CAFFARENA)","MUSEO","CAFFARENA, AGUSTIN R. 49",NA,NA,"D2","caffarena agustin r 49","^([a-z ]*)([0-9]+)","caffarena agustin r","49"
"MUSEO DEL CINE PABLO DUCROS HICKEN (SEDE FEIJOO)","MUSEO","SALMUN FEIJOO, JOSE AARON 555",NA,NA,"D2","salmun feijoo jose aaron 555","^([a-z ]*)([0-9]+)","salmun feijoo jose aaron","555"
"MUSEO DEL HUMOR (MUHU)","MUSEO","DE LOS ITALIANOS AV. Y VILLAFLOR, AZUCENA",NA,NA,"D2","de los italianos av y villaflor azucena","","de los italianos av y villaflor azucena","de los italianos av y villaflor azucena"
"MUSEO HISTORICO DE BUENOS AIRES CORNELIO DE SAAVEDRA","MUSEO","LARRALDE, CRISOLOGO AV. 6309",NA,NA,"D2","larralde crisologo av 6309","^([a-z ]*)([0-9]+)","larralde crisologo av","6309"
"TORRE MONUMENTAL - CENTRO DE INFORMES DE MUSEOS","MUSEO","DEL LIBERTADOR AV. 49",NA,NA,"D2","del libertador av 49","^([a-z ]*)([0-9]+)","del libertador av","49"
"FERIA DE MATADEROS","PEÑA","DE LOS CORRALES AV. 6501",NA,NA,"D2","de los corrales av 6501","^([a-z ]*)([0-9]+)","de los corrales av","6501"
"PLANETARIO DE LA CIUDAD DE BUENOS AIRES ""GALILEO GALILEI""","PLANETARIO","SARMIENTO AV. Y ROLDAN, BELISARIO AV.",NA,NA,"D2","sarmiento av y roldan belisario av","","sarmiento av y roldan belisario av","sarmiento av y roldan belisario av"
"CAFE VICTORIA","BAR NOTABLE","ENTRE RIOS AV. 114",NA,NA,"D2","entre rios av 114","^([a-z ]*)([0-9]+)","entre rios av","114"
"VARELA VARELITA","BAR NOTABLE","SCALABRINI ORTIZ, RAUL AV. 2102",NA,NA,"D2","scalabrini ortiz raul av 2102","^([a-z ]*)([0-9]+)","scalabrini ortiz raul av","2102"
"PLAZA CAFE","BAR NOTABLE","RIVADAVIA AV. 4732",NA,NA,"D2","rivadavia av 4732","^([a-z ]*)([0-9]+)","rivadavia av","4732"
"8 ESQUINAS","BAR NOTABLE","FOREST AV. 1186",NA,NA,"D2","forest av 1186","^([a-z ]*)([0-9]+)","forest av","1186"
"MODENA DESING","BAR NOTABLE","FIGUEROA ALCORTA, PRES. AV. 2270",NA,NA,"D2","figueroa alcorta pres av 2270","^([a-z ]*)([0-9]+)","figueroa alcorta pres av","2270"
"LA PERLA BAR","BAR NOTABLE","JUJUY AV. 36",NA,NA,"D2","jujuy av 36","^([a-z ]*)([0-9]+)","jujuy av","36"
"LA NUEVA ANDALUZA","BAR NOTABLE","CAMARONES 1412",NA,NA,"D2","camarones 1412","^([a-z ]*)([0-9]+)","camarones","1412"
"LA FLOR DE BARRACAS","BAR NOTABLE","SUAREZ AV. 2095",NA,NA,"D2","suarez av 2095","^([a-z ]*)([0-9]+)","suarez av","2095"
"LA ACADEMIA","BAR NOTABLE","CALLAO AV. 368",NA,NA,"D2","callao av 368","^([a-z ]*)([0-9]+)","callao av","368"
"CAPISCI","BAR NOTABLE","VUELTA DE OBLIGADO 2072",NA,NA,"D2","vuelta de obligado 2072","^([a-z ]*)([0-9]+)","vuelta de obligado","2072"
"CAFFE TABAC","BAR NOTABLE","DEL LIBERTADOR AV. 2300",NA,NA,"D2","del libertador av 2300","^([a-z ]*)([0-9]+)","del libertador av","2300"
"CAFE ROMA","BAR NOTABLE","OLAVARRIA 409",NA,NA,"D2","olavarria 409","^([a-z ]*)([0-9]+)","olavarria","409"
"CAFE PALACIO","BAR NOTABLE","LACROZE, FEDERICO AV. 3901",NA,NA,"D2","lacroze federico av 3901","^([a-z ]*)([0-9]+)","lacroze federico av","3901"
"CAFE DE LA U","BAR NOTABLE","TRIUNVIRATO AV. 4801",NA,NA,"D2","triunvirato av 4801","^([a-z ]*)([0-9]+)","triunvirato av","4801"
"CAFE DE LA ESQUINA","BAR NOTABLE","DEL LIBERTADOR AV. 6169",NA,NA,"D2","del libertador av 6169","^([a-z ]*)([0-9]+)","del libertador av","6169"
"BOSTON CITY","BAR NOTABLE","FLORIDA 165",NA,NA,"D2","florida 165","^([a-z ]*)([0-9]+)","florida","165"
"LA FARMACIA","BAR NOTABLE","DIRECTORIO AV. 2400",NA,NA,"D2","directorio av 2400","^([a-z ]*)([0-9]+)","directorio av","2400"
"TOKIO","BAR NOTABLE","ALVAREZ JONTE AV. 3550",NA,NA,"D2","alvarez jonte av 3550","^([a-z ]*)([0-9]+)","alvarez jonte av","3550"
"THE BRIGHTON","BAR NOTABLE","SARMIENTO 645",NA,NA,"D2","sarmiento 645","^([a-z ]*)([0-9]+)","sarmiento","645"
"PETIT COLON","BAR NOTABLE","LIBERTAD 505",NA,NA,"D2","libertad 505","^([a-z ]*)([0-9]+)","libertad","505"
"MIRAMAR","BAR NOTABLE","SARANDI 1190",NA,NA,"D2","sarandi 1190","^([a-z ]*)([0-9]+)","sarandi","1190"
"LONDON CITY","BAR NOTABLE","DE MAYO AV. 599",NA,NA,"D2","de mayo av 599","^([a-z ]*)([0-9]+)","de mayo av","599"
"LAS VIOLETAS","BAR NOTABLE","RIVADAVIA AV. 3899",NA,NA,"D2","rivadavia av 3899","^([a-z ]*)([0-9]+)","rivadavia av","3899"
"LA POESIA","BAR NOTABLE","CHILE 502",NA,NA,"D2","chile 502","^([a-z ]*)([0-9]+)","chile","502"
"LA GIRALDA","BAR NOTABLE","CORRIENTES AV. 1453",NA,NA,"D2","corrientes av 1453","^([a-z ]*)([0-9]+)","corrientes av","1453"
"LA CORUÑA","BAR NOTABLE","BOLIVAR 982",NA,NA,"D2","bolivar 982","^([a-z ]*)([0-9]+)","bolivar","982"
"LA BIELA","BAR NOTABLE","QUINTANA, MANUEL, PRES. AV. 600",NA,NA,"D2","quintana manuel pres av 600","^([a-z ]*)([0-9]+)","quintana manuel pres av","600"
"FLORIDA GARDEN","BAR NOTABLE","FLORIDA 899",NA,NA,"D2","florida 899","^([a-z ]*)([0-9]+)","florida","899"
"EL PROGRESO","BAR NOTABLE","MONTES DE OCA, MANUEL 1702",NA,NA,"D2","montes de oca manuel 1702","^([a-z ]*)([0-9]+)","montes de oca manuel","1702"
"HIPOPOTAMO","BAR NOTABLE","BRASIL 401",NA,NA,"D2","brasil 401","^([a-z ]*)([0-9]+)","brasil","401"
"EL FARO","BAR NOTABLE","DE LOS CONSTITUYENTES AV. 4099",NA,NA,"D2","de los constituyentes av 4099","^([a-z ]*)([0-9]+)","de los constituyentes av","4099"
"CONFITERIA SAINT MORITZ","BAR NOTABLE","ESMERALDA 894",NA,NA,"D2","esmeralda 894","^([a-z ]*)([0-9]+)","esmeralda","894"
"PLAZA BAR","BAR NOTABLE","FLORIDA 1005",NA,NA,"D2","florida 1005","^([a-z ]*)([0-9]+)","florida","1005"
"OLIMPO","BAR NOTABLE","ARREGUI 5794",NA,NA,"D2","arregui 5794","^([a-z ]*)([0-9]+)","arregui","5794"
"LOS LAURELES","BAR NOTABLE","IRIARTE, GRAL. AV. 2290",NA,NA,"D2","iriarte gral av 2290","^([a-z ]*)([0-9]+)","iriarte gral av","2290"
"LE CARAVELLE","BAR NOTABLE","LAVALLE 726",NA,NA,"D2","lavalle 726","^([a-z ]*)([0-9]+)","lavalle","726"
"LA PUERTO RICO","BAR NOTABLE","ALSINA, ADOLFO 416",NA,NA,"D2","alsina adolfo 416","^([a-z ]*)([0-9]+)","alsina adolfo","416"
"LA PERLA","BAR NOTABLE","DON PEDRO DE MENDOZA AV. 1891",NA,NA,"D2","don pedro de mendoza av 1891","^([a-z ]*)([0-9]+)","don pedro de mendoza av","1891"
"LA EMBAJADA","BAR NOTABLE","SANTIAGO DEL ESTERO 88",NA,NA,"D2","santiago del estero 88","^([a-z ]*)([0-9]+)","santiago del estero","88"
"LA BUENA MEDIDA","BAR NOTABLE","SUAREZ 101",NA,NA,"D2","suarez 101","^([a-z ]*)([0-9]+)","suarez","101"
"IBERIA","BAR NOTABLE","DE MAYO AV. 1196",NA,NA,"D2","de mayo av 1196","^([a-z ]*)([0-9]+)","de mayo av","1196"
"EL QUERANDI","BAR NOTABLE","PERU 302",NA,NA,"D2","peru 302","^([a-z ]*)([0-9]+)","peru","302"
"EL PREFERIDO DE PALERMO","BAR NOTABLE","BORGES, JORGE LUIS 2108",NA,NA,"D2","borges jorge luis 2108","^([a-z ]*)([0-9]+)","borges jorge luis","2108"
"EL GATO NEGRO","BAR NOTABLE","CORRIENTES AV. 1669",NA,NA,"D2","corrientes av 1669","^([a-z ]*)([0-9]+)","corrientes av","1669"
"CONFITERIA IDEAL","BAR NOTABLE","SUIPACHA 384",NA,NA,"D2","suipacha 384","^([a-z ]*)([0-9]+)","suipacha","384"
"CLASICA Y MODERNA","BAR NOTABLE","CALLAO AV. 892",NA,NA,"D2","callao av 892","^([a-z ]*)([0-9]+)","callao av","892"
"CAFE RETIRO","BAR NOTABLE","RAMOS MEJIA, JOSE MARIA, DR. AV. 1358",NA,NA,"D2","ramos mejia jose maria dr av 1358","^([a-z ]*)([0-9]+)","ramos mejia jose maria dr av","1358"
"CAFE MARGOT","BAR NOTABLE","BOEDO AV. 857",NA,NA,"D2","boedo av 857","^([a-z ]*)([0-9]+)","boedo av","857"
