"NOMBRE","ACTIVIDAD","DIRECCION","X","X.1","origin","DIRECCION.CLEAN","regexp","calle","numero"
"BIBLIOTECA DE LA UNIVERSIDAD DE BELGRANO","BIBLIOTECA","ZABALA 1851",NA,NA,"D2","zabala 1851","^([a-z ]*)([0-9]+)","zabala","1851"
"BIBLIOTECA DE LA ACADEMIA NACIONAL DE CIENCIAS EXACTAS, FISICAS Y NATURALES","BIBLIOTECA","ALVEAR 1711",NA,NA,"D2","alvear 1711","^([a-z ]*)([0-9]+)","alvear","1711"
"BIBLIOTECA DE LA ASOCIACION DE BIBLIOTECARIOS GRADUADOS DE LA REPUBLICA ARGENTINA ""REINALDO JOSE SUAREZ""","BIBLIOTECA","PARANA 918",NA,NA,"D2","parana 918","^([a-z ]*)([0-9]+)","parana","918"
"BIBLIOTECA DE LA FACULTAD DE DERECHO DE LA UBA","BIBLIOTECA","FIGUEROA ALCORTA, PRES. AV. 2263",NA,NA,"D2","figueroa alcorta pres av 2263","^([a-z ]*)([0-9]+)","figueroa alcorta pres av","2263"
"BIBLIOTECA NACIONAL","BIBLIOTECA","AGUERO 2502",NA,NA,"D2","aguero 2502","^([a-z ]*)([0-9]+)","aguero","2502"
"BIBLIOTECA DE LA SOCIEDAD ARGENTINA DE REUMATOLOGIA","BIBLIOTECA","CALLAO AV. 384",NA,NA,"D2","callao av 384","^([a-z ]*)([0-9]+)","callao av","384"
"BIBLIOTECA DEL INSTITUTO NACIONAL DE TECNOLOGIA AGROPECUARIA - INSTITUTO DE ECONOMIA Y SOCIOLOGIA","BIBLIOTECA","CERVIÃ‘O AV. 3101",NA,NA,"D2","cerviao av 3101","^([a-z ]*)([0-9]+)","cerviao av","3101"
"BIBLIOTECA DEL MUSEO NACIONAL DE ARTE DECORATIVO","BIBLIOTECA","DEL LIBERTADOR AV. 1902",NA,NA,"D2","del libertador av 1902","^([a-z ]*)([0-9]+)","del libertador av","1902"
"BIBLIOTECA DEL CENTRO DE INVESTIGACIONES FILOSOFICAS CIF","BIBLIOTECA","MIÃ‘ONES 2073",NA,NA,"D2","miaones 2073","^([a-z ]*)([0-9]+)","miaones","2073"
"INSTITUTO DE GEOCRONOLOGIA Y GEOLOGIA ISOTOPICA","BIBLIOTECA","GUIRALDES, INT. 2620",NA,NA,"D2","guiraldes int 2620","^([a-z ]*)([0-9]+)","guiraldes int","2620"
"INSTITUTO NACIONAL SAN MARTINIANO","BIBLIOTECA","CASTILLA, RAMON, MARISCAL Y AGUADO, ALEJANDRO M. DE",NA,NA,"D2","castilla ramon mariscal y aguado alejandro m de","","castilla ramon mariscal y aguado alejandro m de","castilla ramon mariscal y aguado alejandro m de"
"INSTITUTO DE BIOLOGIA Y MEDICINA EXPERIMENTAL","BIBLIOTECA","VUELTA DE OBLIGADO 2490",NA,NA,"D2","vuelta de obligado 2490","^([a-z ]*)([0-9]+)","vuelta de obligado","2490"
"INSTITUTO NACIONAL DE ANTROPOLOGIA Y PENSAMIENTO LATINOAMERICA - BIBLIOTECA Y CENTRO DE DOCUMENTACION ""JUAN ANTONIO CARRIZO""","BIBLIOTECA","3 DE FEBRERO 1378",NA,NA,"D2","3 de febrero 1378","^([a-z ]*)([0-9]+)","de febrero 1378","3 de febrero 1378"
"BIBLIOTECA CENTRAL DE CIUDAD UNIVERSITARIA (UBA)","BIBLIOTECA","GUIRALDES, INT. 2620",NA,NA,"D2","guiraldes int 2620","^([a-z ]*)([0-9]+)","guiraldes int","2620"
"BIBLIOTECA DEL INSTITUTO ARGENTINO DE MATEMATICA ""ALBERTO CALDERON""","BIBLIOTECA","SAAVEDRA 15",NA,NA,"D2","saavedra 15","^([a-z ]*)([0-9]+)","saavedra","15"
"BIBLIOTECA DEL CENTRO ARGENTINO DE INFORMACION CIENTIFICA Y TECNOLOGICA","BIBLIOTECA","SAAVEDRA 15",NA,NA,"D2","saavedra 15","^([a-z ]*)([0-9]+)","saavedra","15"
"RED DE BIBLIOTECAS UNIVERSITARIAS DEL SALVADOR RED BUS","BIBLIOTECA","PERON, JUAN DOMINGO, TTE. GENERAL 1818",NA,NA,"D2","peron juan domingo tte general 1818","^([a-z ]*)([0-9]+)","peron juan domingo tte general","1818"
"BIBLIOTECA ALVEAR ""R.P. ERNESTO DANN OBREGON S.J"" UNIVERSIDAD DEL SALVADOR","BIBLIOTECA","ALVEAR, MARCELO T. DE 1312",NA,NA,"D2","alvear marcelo t de 1312","^([a-z ]*)([0-9]+)","alvear marcelo t de","1312"
"BIBLIOTECA ""FINOCHIETTO"" DE LA FACULTAD DE MEDICINA UNIVERSIDAD DEL SALVADOR","BIBLIOTECA","TUCUMAN 1845",NA,NA,"D2","tucuman 1845","^([a-z ]*)([0-9]+)","tucuman","1845"
"BIBLIOTECA DEL HOSPITAL MATERNO INFANTIL RAMON SARDA","BIBLIOTECA","LUCA, ESTEBAN DE 2151",NA,NA,"D2","luca esteban de 2151","^([a-z ]*)([0-9]+)","luca esteban de","2151"
"BIBLIOTECA ""DR. MARTIN VAZQUEZ VIGO"" DE LA ASOCIACION MEDICOS MUNICIPALES DE LA CIUDAD DE BS.AS.","BIBLIOTECA","PACHECO DE MELO, JOSE ANDRES 2034",NA,NA,"D2","pacheco de melo jose andres 2034","^([a-z ]*)([0-9]+)","pacheco de melo jose andres","2034"
"BIBLIOTECA DEL CENTRO DE ECONOMIA INTERNACIONAL (CEI)","BIBLIOTECA","ESMERALDA 1212",NA,NA,"D2","esmeralda 1212","^([a-z ]*)([0-9]+)","esmeralda","1212"
"BIBLIOTECA NACIONAL DE METEOROLOGIA ?ING. ALFREDO G. GALMARINI?","BIBLIOTECA","25 DE MAYO 658",NA,NA,"D2","25 de mayo 658","^([a-z ]*)([0-9]+)","de mayo 658","25 de mayo 658"
"BIBLIOTECA CENTRAL DE UNIVERSIDAD ABIERTA INTERAMERICANA","BIBLIOTECA","MONTES DE OCA, MANUEL 745",NA,NA,"D2","montes de oca manuel 745","^([a-z ]*)([0-9]+)","montes de oca manuel","745"
"BIBLIOTECA UNIVERSITARIA DEL CINE","BIBLIOTECA","GIUFFRA, JOSE M.,DR. 330",NA,NA,"D2","giuffra jose mdr 330","^([a-z ]*)([0-9]+)","giuffra jose mdr","330"
"CENTRO DOCUMENTAL Y BIBLIOTECA DEL ATENEO ARGENTINO DE ODONTOLOGIA","BIBLIOTECA","ANCHORENA, TOMAS MANUEL DE, DR. 1176",NA,NA,"D2","anchorena tomas manuel de dr 1176","^([a-z ]*)([0-9]+)","anchorena tomas manuel de dr","1176"
"BIBLIOTECA CENTRAL DE LA UNIVERSIDAD AUSTRAL","BIBLIOTECA","GARAY, JUAN DE AV. 125",NA,NA,"D2","garay juan de av 125","^([a-z ]*)([0-9]+)","garay juan de av","125"
"BIBLIOTECA ""DR. CARLOS CARDINI"" DE LA FUNDACION INSTITUTO LELOIR","BIBLIOTECA","PATRICIAS ARGENTINAS AV. 435",NA,NA,"D2","patricias argentinas av 435","^([a-z ]*)([0-9]+)","patricias argentinas av","435"
"BIBLIOTECA ""UTOPIA"" DEL CENTRO CULTURAL DE LA COOPERACION","BIBLIOTECA","CORRIENTES AV. 1543",NA,NA,"D2","corrientes av 1543","^([a-z ]*)([0-9]+)","corrientes av","1543"
"BIBLIOTECA UNIVERSITARIA MAIMONIDES","BIBLIOTECA","HIDALGO 775",NA,NA,"D2","hidalgo 775","^([a-z ]*)([0-9]+)","hidalgo","775"
"BIBLIOTECA Y ARCHIVO DOCUMENTAL DEL INSTITUTO NACIONAL DE TECNOLOGIA AGROPECUARIA (INTA)","BIBLIOTECA","CHILE 460",NA,NA,"D2","chile 460","^([a-z ]*)([0-9]+)","chile","460"
"BIBLIOTECA ""EZEQUIEL MARTINEZ ESTRADA"" DE LA UNIVERSIDAD FAVALORO","BIBLIOTECA","BELGRANO AV. 1720",NA,NA,"D2","belgrano av 1720","^([a-z ]*)([0-9]+)","belgrano av","1720"
"BIBLIOTECA Y CENTRO MULTIMEDIA DE LA FACULTAD DE CIENCIAS VETERINARIAS UBA","BIBLIOTECA","CHORROARIN AV. 280",NA,NA,"D2","chorroarin av 280","^([a-z ]*)([0-9]+)","chorroarin av","280"
"BIBLIOTECA DEL ALMA MATER STUDIORUM UNIVERSIDAD DI BOLOGNA","BIBLIOTECA","RODRIGUEZ PE�A 1464",NA,NA,"D2",NA,"",NA,NA
"BIBLIOTECA ""PROFESOR EMERITO DR. ALFREDO L. PALACIOS""","BIBLIOTECA","CORDOBA AV. 2122",NA,NA,"D2","cordoba av 2122","^([a-z ]*)([0-9]+)","cordoba av","2122"
"BIBLIOTECA BARTOLOME MITRE COLEGIO PUBLICO DE TRADUCTORES","BIBLIOTECA","CORRIENTES AV. 1834",NA,NA,"D2","corrientes av 1834","^([a-z ]*)([0-9]+)","corrientes av","1834"
"CENTRO LATINOAMERICANO DE DOCUMENTACION INFORMATICA Y ELECTRONICA","BIBLIOTECA","URUGUAY 252",NA,NA,"D2","uruguay 252","^([a-z ]*)([0-9]+)","uruguay","252"
"BIBLIOTECA DEL COLEGIO DE ABOGADOS DE LA CIUDAD DE BUENOS AIRES","BIBLIOTECA","MONTEVIDEO 640",NA,NA,"D2","montevideo 640","^([a-z ]*)([0-9]+)","montevideo","640"
"ARCHIVO TECNICO DE LA SECRETARIA DE ENERGIA","BIBLIOTECA","PASEO COLON AV. 171",NA,NA,"D2","paseo colon av 171","^([a-z ]*)([0-9]+)","paseo colon av","171"
"BIBLIOTECA DE LA COMISION NACIONAL DE COMERCIO EXTERIOR","BIBLIOTECA","PASEO COLON AV. 275",NA,NA,"D2","paseo colon av 275","^([a-z ]*)([0-9]+)","paseo colon av","275"
"BIBLIOTECA DE DEFENSA ""GENERALA JUANA AZURDUY""","BIBLIOTECA","AZOPARDO Y MORENO",NA,NA,"D2","azopardo y moreno","","azopardo y moreno","azopardo y moreno"
"ARCHIVO GENERAL DE LA NACION - ARCHIVO INTERMEDIO","ARCHIVO","PASEO COLON AV. 1093",NA,NA,"D2","paseo colon av 1093","^([a-z ]*)([0-9]+)","paseo colon av","1093"
"CENTRO BIBLIOGRAFICO DE ENFERMEDADES ENDEMICAS","BIBLIOTECA","PASEO COLON AV. 568",NA,NA,"D2","paseo colon av 568","^([a-z ]*)([0-9]+)","paseo colon av","568"
"INSTITUTO NACIONAL DE ALIMENTOS","ARCHIVO","ESTADOS UNIDOS 25",NA,NA,"D2","estados unidos 25","^([a-z ]*)([0-9]+)","estados unidos","25"
"BIBLIOTECA LABORATORIOS ALCON ""CARLOS S. DAMEL""","BIBLIOTECA","PERON, JUAN DOMINGO, TTE. GENERAL 1479",NA,NA,"D2","peron juan domingo tte general 1479","^([a-z ]*)([0-9]+)","peron juan domingo tte general","1479"
"CENTRO DE INFORMACION Y DOCUMENTACION EN ONCOLOGIA","ARCHIVO","TUCUMAN 731",NA,NA,"D2","tucuman 731","^([a-z ]*)([0-9]+)","tucuman","731"
"BIBLIOTECA ESCUELA SUPERIOR DE GUERRA AEREA","BIBLIOTECA","ZANNI PEDRO COMODORO 250",NA,NA,"D2","zanni pedro comodoro 250","^([a-z ]*)([0-9]+)","zanni pedro comodoro","250"
"BIBLIOTECA MARISEL MONTOTO RODRIGUEZ","BIBLIOTECA","DE MAYO AV. 866",NA,NA,"D2","de mayo av 866","^([a-z ]*)([0-9]+)","de mayo av","866"
"BIBLIOTECA DE LA UNION INDUSTRIAL ARGENTINA","ARCHIVO","DE MAYO AV. 1147",NA,NA,"D2","de mayo av 1147","^([a-z ]*)([0-9]+)","de mayo av","1147"
"UNIVERSIDAD DEL CEMA ADRIAN GUISARRI","BIBLIOTECA","CORDOBA AV. 400",NA,NA,"D2","cordoba av 400","^([a-z ]*)([0-9]+)","cordoba av","400"
"BIBLIOTECA DR. LAUREANO RIVAS MIGUEZ DEL HOSPITAL DE NIÑOS RICARDO GUTIERREZ","BIBLIOTECA","GALLO 1330",NA,NA,"D2","gallo 1330","^([a-z ]*)([0-9]+)","gallo","1330"
"SOCIEDAD ARGENTINA DE ORTODONCIA","BIBLIOTECA","MONTEVIDEO 971",NA,NA,"D2","montevideo 971","^([a-z ]*)([0-9]+)","montevideo","971"
"FUNDACION ""DR. HECTOR BARCELO""","BIBLIOTECA","LAS HERAS GENERAL AV. 2191",NA,NA,"D2","las heras general av 2191","^([a-z ]*)([0-9]+)","las heras general av","2191"
"BIBLIOTECA JOSE MURTHAG","BIBLIOTECA","DIAZ, CNEL. AV. 1971",NA,NA,"D2","diaz cnel av 1971","^([a-z ]*)([0-9]+)","diaz cnel av","1971"
"BIBLIOTECA DEL COLEGIO NACIONAL BUENOS AIRES","BIBLIOTECA","BOLIVAR 263",NA,NA,"D2","bolivar 263","^([a-z ]*)([0-9]+)","bolivar","263"
"INSTITUTO DE INVESTIGACIONES JURIDICAS Y SOCIALES AMBROSIO L. GIOJA","BIBLIOTECA","FIGUEROA ALCORTA, PRES. AV. 2263",NA,NA,"D2","figueroa alcorta pres av 2263","^([a-z ]*)([0-9]+)","figueroa alcorta pres av","2263"
"BIBLIOTECA CENTRAL ""DR. LUIS F. LELOIR""","BIBLIOTECA","GUIRALDES, INT. 2620",NA,NA,"D2","guiraldes int 2620","^([a-z ]*)([0-9]+)","guiraldes int","2620"
"BIBLIOTECA CENTRAL DE LA FACULTAD DE AGRONOMIA (UBA)","BIBLIOTECA","SAN MARTIN AV. 4453",NA,NA,"D2","san martin av 4453","^([a-z ]*)([0-9]+)","san martin av","4453"
"BIBLIOTECA CENTRAL DEL ESTADO MAYOR CONJUNTO DE LAS FUERZAS ARMADAS","BIBLIOTECA","PASEO COLON AV. 255",NA,NA,"D2","paseo colon av 255","^([a-z ]*)([0-9]+)","paseo colon av","255"
"BIBLIOTECA DEL INSTITUTO NACIONAL DE LA PROPIEDAD INDUSTRIAL (I.N.P.I.)","BIBLIOTECA","PASEO COLON AV. 717",NA,NA,"D2","paseo colon av 717","^([a-z ]*)([0-9]+)","paseo colon av","717"
"CENTRO DE DOCUMENTACION E INFORMACION ""DR. JORGE EDUARDO COLL""","BIBLIOTECA","PERON, JUAN DOMINGO, TTE. GENERAL 524",NA,NA,"D2","peron juan domingo tte general 524","^([a-z ]*)([0-9]+)","peron juan domingo tte general","524"
"PEÑA DE TANGO ALMA DE BOHEMIO DEL CLUB SOCIAL BOHEMIO","MILONGA Y/O TANGUERIA","NECOCHEA 948",NA,NA,"D2","necochea 948","^([a-z ]*)([0-9]+)","necochea","948"
"MILONGA NUEVO SALON ARGENTINA","MILONGA Y/O TANGUERIA","MITRE, BARTOLOME 1759",NA,NA,"D2","mitre bartolome 1759","^([a-z ]*)([0-9]+)","mitre bartolome","1759"
"MILONGA PARAKULTURAL","MILONGA Y/O TANGUERIA","SCALABRINI ORTIZ, RAUL AV. 1331",NA,NA,"D2","scalabrini ortiz raul av 1331","^([a-z ]*)([0-9]+)","scalabrini ortiz raul av","1331"
"CIRCULO TROVADOR","MILONGA Y/O TANGUERIA","DEL LIBERTADOR AV. 1031",NA,NA,"D2","del libertador av 1031","^([a-z ]*)([0-9]+)","del libertador av","1031"
"MILONGA GAY LA MARSHALL","MILONGA Y/O TANGUERIA","RIOBAMBA 416",NA,NA,"D2","riobamba 416","^([a-z ]*)([0-9]+)","riobamba","416"
"EL BESO","MILONGA Y/O TANGUERIA","RIOBAMBA 416",NA,NA,"D2","riobamba 416","^([a-z ]*)([0-9]+)","riobamba","416"
"BOEDO TANGO","MILONGA Y/O TANGUERIA","SAN JUAN AV. 3330",NA,NA,"D2","san juan av 3330","^([a-z ]*)([0-9]+)","san juan av","3330"
"CLUB PIAMONTES - SALON RODRIGUEZ","MILONGA Y/O TANGUERIA","RODRIGUEZ, MANUEL A., GENERAL 1191",NA,NA,"D2","rodriguez manuel a general 1191","^([a-z ]*)([0-9]+)","rodriguez manuel a general","1191"
"CLUB CRISOL UNIDOS - MILONGA SARAZA TANGO","MILONGA Y/O TANGUERIA","SARAZA 951",NA,NA,"D2","saraza 951","^([a-z ]*)([0-9]+)","saraza","951"
"SOCIEDAD DE FOMENTO MARIANO ACOSTA - MILONGA LA TIERRITA","MILONGA Y/O TANGUERIA","ACOSTA, MARIANO 1544",NA,NA,"D2","acosta mariano 1544","^([a-z ]*)([0-9]+)","acosta mariano","1544"
"CLUB SUNDERLAND - LA MILONGA DEL MUNDO","MILONGA Y/O TANGUERIA","LUGONES 3161",NA,NA,"D2","lugones 3161","^([a-z ]*)([0-9]+)","lugones","3161"
"ESQUINA CARLOS GARDEL","MILONGA Y/O TANGUERIA","GARDEL, CARLOS 3200",NA,NA,"D2","gardel carlos 3200","^([a-z ]*)([0-9]+)","gardel carlos","3200"
"EL VIEJO ALMACEN","MILONGA Y/O TANGUERIA","INDEPENDENCIA AV. 303",NA,NA,"D2","independencia av 303","^([a-z ]*)([0-9]+)","independencia av","303"
"MILONGA EL ARRANQUE","MILONGA Y/O TANGUERIA","MITRE, BARTOLOME 1759",NA,NA,"D2","mitre bartolome 1759","^([a-z ]*)([0-9]+)","mitre bartolome","1759"
"GRUPO DE TEATRO ALMA MATE DE FEORES","ESPACIO ESCENICO (TEATRO, MUSICA Y DANZA)","NAZCA AV. Y NEUQUEN",NA,NA,"D2","nazca av y neuquen","","nazca av y neuquen","nazca av y neuquen"
"CASAL DE CATALUNYA","ESPACIO ESCENICO (TEATRO, MUSICA Y DANZA)","CHACABUCO 863",NA,NA,"D2","chacabuco 863","^([a-z ]*)([0-9]+)","chacabuco","863"
"EL TEATRO DE FLORES","ESPACIO ESCENICO (TEATRO, MUSICA Y DANZA)","RIVERA INDARTE AV. 129",NA,NA,"D2","rivera indarte av 129","^([a-z ]*)([0-9]+)","rivera indarte av","129"
"CLUB DE AMIGOS DE LA VACA PROFANA","ESPACIO ESCENICO (TEATRO, MUSICA Y DANZA)","LAVALLE 3683",NA,NA,"D2","lavalle 3683","^([a-z ]*)([0-9]+)","lavalle","3683"
"CLUB DE TRAPECISTAS","ESPACIO ESCENICO (TEATRO, MUSICA Y DANZA)","FERRARI 252",NA,NA,"D2","ferrari 252","^([a-z ]*)([0-9]+)","ferrari","252"
"TEATRO DEL GLOBO","ESPACIO ESCENICO (TEATRO, MUSICA Y DANZA)","ALVEAR, MARCELO T. DE 1155",NA,NA,"D2","alvear marcelo t de 1155","^([a-z ]*)([0-9]+)","alvear marcelo t de","1155"
"YUPANQUI","ESPACIO ESCENICO (TEATRO, MUSICA Y DANZA)","GUAMINI 4512",NA,NA,"D2","guamini 4512","^([a-z ]*)([0-9]+)","guamini","4512"
"SALA LA NAZCA","ESPACIO ESCENICO (TEATRO, MUSICA Y DANZA)","NAZCA AV. 1000",NA,NA,"D2","nazca av 1000","^([a-z ]*)([0-9]+)","nazca av","1000"
"BARTOLOMEO","ESPACIO ESCENICO (TEATRO, MUSICA Y DANZA)","MITRE, BARTOLOME 1525",NA,NA,"D2","mitre bartolome 1525","^([a-z ]*)([0-9]+)","mitre bartolome","1525"
"FRAY MOCHO","ESPACIO ESCENICO (TEATRO, MUSICA Y DANZA)","PERON, JUAN DOMINGO, TTE. GENERAL 3644",NA,NA,"D2","peron juan domingo tte general 3644","^([a-z ]*)([0-9]+)","peron juan domingo tte general","3644"
"ESPACIO AGUIRRE","ESPACIO ESCENICO (TEATRO, MUSICA Y DANZA)","AGUIRRE 1270",NA,NA,"D2","aguirre 1270","^([a-z ]*)([0-9]+)","aguirre","1270"
"ESPACIO CULTURAL URBANO","ESPACIO ESCENICO (TEATRO, MUSICA Y DANZA)","ACEVEDO 460",NA,NA,"D2","acevedo 460","^([a-z ]*)([0-9]+)","acevedo","460"
"VERA VERA TEATRO","ESPACIO ESCENICO (TEATRO, MUSICA Y DANZA)","VERA 108",NA,NA,"D2","vera 108","^([a-z ]*)([0-9]+)","vera","108"
"ESPACIO INCAA KM2 LA MASCARA","CINE","PIEDRAS 736",NA,NA,"D2","piedras 736","^([a-z ]*)([0-9]+)","piedras","736"
"CINE LORCA","CINE","CORRIENTES AV. 1420",NA,NA,"D2","corrientes av 1420","^([a-z ]*)([0-9]+)","corrientes av","1420"
"ARTE CINEMA ESPACIO INCAA KM3","CINE","SALTA 1620",NA,NA,"D2","salta 1620","^([a-z ]*)([0-9]+)","salta","1620"
"CINEMA CITY GENERAL PAZ","CINE","CABILDO AV. 2702",NA,NA,"D2","cabildo av 2702","^([a-z ]*)([0-9]+)","cabildo av","2702"
"ESPACIO INCAA KM 0 - GAUMONT","CINE","RIVADAVIA AV. 1635",NA,NA,"D2","rivadavia av 1635","^([a-z ]*)([0-9]+)","rivadavia av","1635"
"MUSEO DE LA HISTORIA DE LA MEDICINA ""VICENTE ANIBAL""","MUSEO","URIBURU JOSE E., PRES. 949",NA,NA,"D2","uriburu jose e pres 949","^([a-z ]*)([0-9]+)","uriburu jose e pres","949"
"MAGUNCIA. MUSEO DEL PAPEL, GRABADO Y ESTAMPA.","MUSEO","DON PEDRO DE MENDOZA AV. 1855",NA,NA,"D2","don pedro de mendoza av 1855","^([a-z ]*)([0-9]+)","don pedro de mendoza av","1855"
"MUSEO HISTORICO Y DE LAS TRADICIONES POPULARES DE LA BOCA","MUSEO","DON PEDRO DE MENDOZA AV. 1727",NA,NA,"D2","don pedro de mendoza av 1727","^([a-z ]*)([0-9]+)","don pedro de mendoza av","1727"
"MUSEO GEOGRAFICO Y MUSEO DE CIENCIAS NATURALES ""DR. JUAN B. TERAN Y ""DR. ANGEL GALLARDO""","MUSEO","CATAMARCA 2099",NA,NA,"D2","catamarca 2099","^([a-z ]*)([0-9]+)","catamarca","2099"
"MUSEO ""GENERAL BELGRANO""","MUSEO","SARACHAGA 4906",NA,NA,"D2","sarachaga 4906","^([a-z ]*)([0-9]+)","sarachaga","4906"
"BAR, PELUQUERIA Y BARBERIA LA EPOCA","BAR CULTURAL","GUAYAQUIL 877",NA,NA,"D2","guayaquil 877","^([a-z ]*)([0-9]+)","guayaquil","877"
"BAR VIRASORO","ESPACIO ESCENICO (TEATRO, MUSICA Y DANZA)","GUATEMALA 4328",NA,NA,"D2","guatemala 4328","^([a-z ]*)([0-9]+)","guatemala","4328"
"BUKOWSKI BAR","BAR CULTURAL","MITRE, BARTOLOME 1525",NA,NA,"D2","mitre bartolome 1525","^([a-z ]*)([0-9]+)","mitre bartolome","1525"
"LIBRERIA CRACK UP","LIBRERIA","COSTA RICA 4767",NA,NA,"D2","costa rica 4767","^([a-z ]*)([0-9]+)","costa rica","4767"
"GALERIA ARROYO","GALERIA DE ARTE","ARROYO 830",NA,NA,"D2","arroyo 830","^([a-z ]*)([0-9]+)","arroyo","830"
"LA ESQUINA DE ANIBAL TROILO","BAR CULTURAL","PARAGUAY 1500",NA,NA,"D2","paraguay 1500","^([a-z ]*)([0-9]+)","paraguay","1500"
"BAR CAFE LA DAMA DE BOLLINI","ESPACIO ESCENICO (TEATRO, MUSICA Y DANZA)","BOLLINI 2281",NA,NA,"D2","bollini 2281","^([a-z ]*)([0-9]+)","bollini","2281"
"LA VIRUTA TANGO","MILONGA Y/O TANGUERIA","ARMENIA 1366",NA,NA,"D2","armenia 1366","^([a-z ]*)([0-9]+)","armenia","1366"
"GALERIA PABELLON 4","GALERIA DE ARTE","URIARTE 1332",NA,NA,"D2","uriarte 1332","^([a-z ]*)([0-9]+)","uriarte","1332"
"CAFE LITERARIO OSVALDO BAYER","BAR CULTURAL","YRIGOYEN, HIPOLITO 1440",NA,NA,"D2","yrigoyen hipolito 1440","^([a-z ]*)([0-9]+)","yrigoyen hipolito","1440"
"CENTRO CULTURAL CASA CABRERA","CENTRO CULTURAL","CABRERA, JOSE A. 3653",NA,NA,"D2","cabrera jose a 3653","^([a-z ]*)([0-9]+)","cabrera jose a","3653"
"CENTRO CULTURAL BARRIAL GENESIS","CENTRO CULTURAL","IBERA 6085",NA,NA,"D2","ibera 6085","^([a-z ]*)([0-9]+)","ibera","6085"
"CENTRO CULTURAL BORGES","CENTRO CULTURAL","VIAMONTE 525",NA,NA,"D2","viamonte 525","^([a-z ]*)([0-9]+)","viamonte","525"
"CENTRO CULTURAL DE LA COOPERACION FLOREAL GORINI","CENTRO CULTURAL","CORRIENTES AV. 1543",NA,NA,"D2","corrientes av 1543","^([a-z ]*)([0-9]+)","corrientes av","1543"
"ESPACIO CULTURAL POMPAPETRIYAZOS","ESPACIO ESCENICO (TEATRO, MUSICA Y DANZA)","BRASIL 2800",NA,NA,"D2","brasil 2800","^([a-z ]*)([0-9]+)","brasil","2800"
"CASA DEL NIÑO Y EL ADOLESCENTE","ESPACIO DE FORMACION (CARRERAS, SEMINARIOS Y TALLERES)","JANER, ANA MARIA Y VEDIA, AGUSTIN DE",NA,NA,"D2","janer ana maria y vedia agustin de","","janer ana maria y vedia agustin de","janer ana maria y vedia agustin de"
"BIBLIOTECA DE LA CAMARA ARGENTINA DE LA INDUSTRIA PLASTICA","BIBLIOTECA","SALGUERO, JERONIMO 1939",NA,NA,"D2","salguero jeronimo 1939","^([a-z ]*)([0-9]+)","salguero jeronimo","1939"
"PEÑA LOS CARDONES","PEÑA","BORGES, JORGE LUIS 2180",NA,NA,"D2","borges jorge luis 2180","^([a-z ]*)([0-9]+)","borges jorge luis","2180"
"PEÑA LA BAGUALA","PEÑA","BROWN, ALTE. AV. 736",NA,NA,"D2","brown alte av 736","^([a-z ]*)([0-9]+)","brown alte av","736"
"LA CUMPARCITA TANGO BAR","MILONGA Y/O TANGUERIA","CHILE AV. 302",NA,NA,"D2","chile av 302","^([a-z ]*)([0-9]+)","chile av","302"
"SEÑOR TANGO","MILONGA Y/O TANGUERIA","VIEYTES 1655",NA,NA,"D2","vieytes 1655","^([a-z ]*)([0-9]+)","vieytes","1655"
"PORTEÑO Y BAILARIN","MILONGA Y/O TANGUERIA","RIOBAMBA 345",NA,NA,"D2","riobamba 345","^([a-z ]*)([0-9]+)","riobamba","345"
"CLUB FULGOR DE VILLA CRESPO - PRAKTIKA8 - MILONGA10","MILONGA Y/O TANGUERIA","LOYOLA 828",NA,NA,"D2","loyola 828","^([a-z ]*)([0-9]+)","loyola","828"
"BIBLIOTECA DEL GOETHE INSTITUTO BUENOS AIRES","BIBLIOTECA","CORRIENTES AV. 343",NA,NA,"D2","corrientes av 343","^([a-z ]*)([0-9]+)","corrientes av","343"
"BIBLIOTECA ""EMILIO FRES"" DE LA UNIVERSIDAD MUSEO SOCIAL ARGENTINO","BIBLIOTECA","CORRIENTES AV. 1723",NA,NA,"D2","corrientes av 1723","^([a-z ]*)([0-9]+)","corrientes av","1723"
"CINE MONUMENTAL LAVALLE","CINE","LAVALLE 780",NA,NA,"D2","lavalle 780","^([a-z ]*)([0-9]+)","lavalle","780"
"ATLAS PATIO BULLRICH","CINE","DEL LIBERTADOR AV. 750",NA,NA,"D2","del libertador av 750","^([a-z ]*)([0-9]+)","del libertador av","750"
"CINEMA DEVOTO","CINE","VARELA, JOSE PEDRO 4866",NA,NA,"D2","varela jose pedro 4866","^([a-z ]*)([0-9]+)","varela jose pedro","4866"
"BAR KAFKA","BAR CULTURAL","PARAGUAY 1846",NA,NA,"D2","paraguay 1846","^([a-z ]*)([0-9]+)","paraguay","1846"
"CINE COSMOS (UBA)","CINE","CORRIENTES AV. 2046",NA,NA,"D2","corrientes av 2046","^([a-z ]*)([0-9]+)","corrientes av","2046"
"ASTROBAR","BAR CULTURAL","MEDRANO AV. 950",NA,NA,"D2","medrano av 950","^([a-z ]*)([0-9]+)","medrano av","950"
"ATLAS FLORES","CINE","RIVERA INDARTE AV. 44",NA,NA,"D2","rivera indarte av 44","^([a-z ]*)([0-9]+)","rivera indarte av","44"
"CENTRO CULTURAL E INFORMATIVO DE LA EMBAJADA DE JAPON","CENTRO CULTURAL","PARAGUAY 1127",NA,NA,"D2","paraguay 1127","^([a-z ]*)([0-9]+)","paraguay","1127"
"CENTRO CULTURAL DE ESPAÑA EN BUENOS AIRES","CENTRO CULTURAL","FLORIDA 493",NA,NA,"D2","florida 493","^([a-z ]*)([0-9]+)","florida","493"
"CIRCUITO CULTURAL BARRACAS","ESPACIO ESCENICO (TEATRO, MUSICA Y DANZA)","IRIARTE, GRAL. AV. 2165",NA,NA,"D2","iriarte gral av 2165","^([a-z ]*)([0-9]+)","iriarte gral av","2165"
"ALIANZA FRANCESA DE BUENOS AIRES (SEDE CORDOBA)","CENTRO CULTURAL","CORDOBA AV. 936",NA,NA,"D2","cordoba av 936","^([a-z ]*)([0-9]+)","cordoba av","936"
"ASOCIACION DANTE ALIGHIERI DE BUENOS AIRES (SEDE TUCUMAN)","CENTRO CULTURAL","TUCUMAN 1646",NA,NA,"D2","tucuman 1646","^([a-z ]*)([0-9]+)","tucuman","1646"
"CENTRO CULTURAL ERNESTO SABATO","CENTRO CULTURAL","URIBURU JOSE E., PRES. 763",NA,NA,"D2","uriburu jose e pres 763","^([a-z ]*)([0-9]+)","uriburu jose e pres","763"
"BRITISH ART CENTRE","CENTRO CULTURAL","SUIPACHA 1333",NA,NA,"D2","suipacha 1333","^([a-z ]*)([0-9]+)","suipacha","1333"
"ESPACIO CULTURAL EMBAJADA DEL BRASIL","CENTRO CULTURAL","ARROYO 1142",NA,NA,"D2","arroyo 1142","^([a-z ]*)([0-9]+)","arroyo","1142"
"CENTRO CULTURAL AGRONOMIA","CENTRO CULTURAL","SAN MARTIN AV. 4453",NA,NA,"D2","san martin av 4453","^([a-z ]*)([0-9]+)","san martin av","4453"
"EL COLECTIVO ARTE EN MOVIMIENTO","CENTRO CULTURAL","IBERA 4836",NA,NA,"D2","ibera 4836","^([a-z ]*)([0-9]+)","ibera","4836"
"ALIANZA FRANCESA DE BUENOS AIRES (SEDE GRANADEROS)","CENTRO CULTURAL","GRANADEROS 61",NA,NA,"D2","granaderos 61","^([a-z ]*)([0-9]+)","granaderos","61"
"EL TUNEL CENTRO CULTURAL","CENTRO CULTURAL","BONPLAND 2050",NA,NA,"D2","bonpland 2050","^([a-z ]*)([0-9]+)","bonpland","2050"
"ALIANZA FRANCESA DE BUENOS AIRES (SEDE 11 DE SETIEMBRE)","CENTRO CULTURAL","11 DE SEPTIEMBRE DE 1888 950",NA,NA,"D2","11 de septiembre de 1888 950","^([a-z ]*)([0-9]+)","de septiembre de 1888 950","11 de septiembre de 1888 950"
"CENTRO CULTURAL DEL ESQUINAZO","CENTRO CULTURAL","PERON, JUAN DOMINGO, TTE. GENERAL 1785",NA,NA,"D2","peron juan domingo tte general 1785","^([a-z ]*)([0-9]+)","peron juan domingo tte general","1785"
"ASOCIACION DANTE ALIGHIERI DE BUENOS AIRES (SEDE CABILDO)","CENTRO CULTURAL","CABILDO AV. 2772",NA,NA,"D2","cabildo av 2772","^([a-z ]*)([0-9]+)","cabildo av","2772"
"CENTRO CULTURAL COREANO","CENTRO CULTURAL","DIAZ, CNEL. AV. 2884",NA,NA,"D2","diaz cnel av 2884","^([a-z ]*)([0-9]+)","diaz cnel av","2884"
"CASA NACIONAL DEL BICENTENARIO","CENTRO CULTURAL","RIOBAMBA 985",NA,NA,"D2","riobamba 985","^([a-z ]*)([0-9]+)","riobamba","985"
"CIUDAD CULTURAL KONEX","CENTRO CULTURAL","SARMIENTO 3131",NA,NA,"D2","sarmiento 3131","^([a-z ]*)([0-9]+)","sarmiento","3131"
"CENTRO CULTURAL ISLAMICO","CENTRO CULTURAL","BULLRICH, INT. AV. 55",NA,NA,"D2","bullrich int av 55","^([a-z ]*)([0-9]+)","bullrich int av","55"
"CENTRO CULTURAL ENRIQUE SANTOS DISCEPOLO","CENTRO CULTURAL","RIVAROLA, RODOLFO, DR. 154",NA,NA,"D2","rivarola rodolfo dr 154","^([a-z ]*)([0-9]+)","rivarola rodolfo dr","154"
"CENTRO CULTURAL JOSE INGENIEROS","CENTRO CULTURAL","PARAGUAY 2155",NA,NA,"D2","paraguay 2155","^([a-z ]*)([0-9]+)","paraguay","2155"
"ESPACIO SOCIAL Y CULTURAL COMUNARTE","CENTRO CULTURAL","CASTRO BARROS AV. 236",NA,NA,"D2","castro barros av 236","^([a-z ]*)([0-9]+)","castro barros av","236"
"CENTRO CULTURAL EL SURCO","CENTRO CULTURAL","BOEDO AV. 830",NA,NA,"D2","boedo av 830","^([a-z ]*)([0-9]+)","boedo av","830"
"ASOCIACION DANTE ALIGHIERI DE BUENOS AIRES (SEDE COMODORO MARTIN RIVADAVIA)","CENTRO CULTURAL","RIVADAVIA AV. 6460",NA,NA,"D2","rivadavia av 6460","^([a-z ]*)([0-9]+)","rivadavia av","6460"
"CENTRO CULTURAL MARTIN FIERRO","CENTRO CULTURAL","CHORROARIN AV. 280",NA,NA,"D2","chorroarin av 280","^([a-z ]*)([0-9]+)","chorroarin av","280"
"CENTRO CULTURAL ""FRANCISCO PACO URONDO""","CENTRO CULTURAL","25 DE MAYO 221",NA,NA,"D2","25 de mayo 221","^([a-z ]*)([0-9]+)","de mayo 221","25 de mayo 221"
"CENTRO CULTURAL FACULTAD DE FILOSOFIA Y LETRAS DE LA PONTIFICIA UNIVERSIDAD CATOLICA","CENTRO CULTURAL","MOREAU DE JUSTO, ALICIA AV. 1500",NA,NA,"D2","moreau de justo alicia av 1500","^([a-z ]*)([0-9]+)","moreau de justo alicia av","1500"
"ASOCIACION DANTE ALIGHIERI DE BUENOS AIRES (SEDE MONTES DE OCA)","CENTRO CULTURAL","MONTES DE OCA, MANUEL 501",NA,NA,"D2","montes de oca manuel 501","^([a-z ]*)([0-9]+)","montes de oca manuel","501"
"CASA DE LA CULTURA LOS COMPADRES DEL HORIZONTE","CENTRO CULTURAL","COMBATE DE LOS POZOS 1936",NA,NA,"D2","combate de los pozos 1936","^([a-z ]*)([0-9]+)","combate de los pozos","1936"
"CENTRO CULTURAL EL QUIJOTERO","CENTRO CULTURAL","FIGUEROA, D. APOLINARIO, CORONEL 936",NA,NA,"D2","figueroa d apolinario coronel 936","^([a-z ]*)([0-9]+)","figueroa d apolinario coronel","936"
"CASA POPULAR VIENTOS DEL PUEBLO","CENTRO CULTURAL","IRIGOYEN 2587",NA,NA,"D2","irigoyen 2587","^([a-z ]*)([0-9]+)","irigoyen","2587"
"CENTRO CULTURAL EL QUIJOTE","CENTRO CULTURAL","ARAOZ 176",NA,NA,"D2","araoz 176","^([a-z ]*)([0-9]+)","araoz","176"
"CENTRO CULTURAL EL SURCO DE MATADEROS","CENTRO CULTURAL","OLIDEN 1440",NA,NA,"D2","oliden 1440","^([a-z ]*)([0-9]+)","oliden","1440"
